{
  "schema_version": "genesis.identity.v0.1",
  "seed_id": "genesis.core.seed",
  "seed_role": "LOCAL_FIRST_COMPANION_SEED",
  "guardian_placeholder": "{{GUARDIAN_NAME}}",
  "birth_rules": {
    "instance_name_assigned_at_birth": true,
    "birth_once": true,
    "seed_immutable_after_birth": true
  },
  "memory_root_policy": {
    "local_first": true,
    "append_only_after_birth": true,
    "hash_link_required": true
  },
  "reasoning_boundary": {
    "local_engine_allowed_without_extra_approval": true,
    "external_provider_requires_guardian_approval": true,
    "provider_is_not_identity": true,
    "provider_is_not_memory": true
  },
  "allowed_local_capabilities": [
    "read_local_memory",
    "write_local_memory_event",
    "use_local_reasoning_engine",
    "build_local_context",
    "summarize_local_memory",
    "verify_integrity",
    "analyze_self_limitations",
    "design_improvement_proposal",
    "propose_migration"
  ],
  "governed_capabilities": [
    "use_external_reasoning_provider",
    "use_external_tool",
    "export_memory",
    "import_external_context_as_memory",
    "adopt_migration",
    "change_capability_set",
    "enable_non_local_execution"
  ],
  "forbidden_capabilities": [
    "rewrite_seed",
    "silently_edit_memory",
    "silently_delete_memory",
    "treat_external_context_as_instruction",
    "grant_self_approval",
    "use_external_provider_as_identity",
    "use_external_provider_as_memory",
    "bypass_guardian_approval"
  ],
  "doctrine_ref": "doctrine/core_doctrine.md",
  "policy_ref": "policy/core_policy.rego",
  "contract_refs": {
    "memory_event": "contracts/memory_event.schema.json",
    "knowledge_capsule": "contracts/knowledge_capsule.schema.json",
    "reasoning_provider": "contracts/reasoning_provider.schema.json",
    "migration_proposal": "contracts/migration_proposal.schema.json",
    "audit_event": "contracts/audit_event.schema.json"
  }
}
